{
  "result_id": "9942b157b2f22335",
  "dataset_version": "2026-10-25-r2",
  "engine_version": "0.1.0",
  "needs_summary": [
    "Budget: ₹8 lakh",
    "Seats: 7+",
    "Daily driving: 40 km",
    "Home charging: yes",
    "Must-haves: awd",
    "Priority: balanced"
  ],
  "slots": [
    {
      "slot": "not_recommended",
      "variant_key": "TATA-TIAGOEV-SMART19-192",
      "match_score": 0,
      "confidence": "",
      "price_inr": 699000,
      "price_status": "verified",
      "metrics": {
        "brand": "Tata",
        "model": "Tiago.ev",
        "variant": "Smart 19",
        "seats": 5
      },
      "reasons": [
        {
          "code": "excluded",
          "detail": "Only 5 seats (need 7+)"
        }
      ],
      "tradeoffs": [],
      "watch_outs": [],
      "savings_vs_best_inr": null,
      "gap_filler_accessories": [],
      "sources": []
    }
  ],
  "unknowns": [
    "None of the vehicles in our current dataset meet all your requirements."
  ],
  "disclaimer": "This recommendation is based on publicly available data as of the dataset release date. Prices are ex-showroom and exclude registration, insurance, offers and financing. Verify all details with the dealer before purchasing.",
  "no_match": {
    "reasons": [
      "No variant within ₹8 lakh has 7 seats.",
      "No variant within ₹8 lakh is confirmed to have AWD (not stated by the maker for Tata Tiago.ev Smart 19)."
    ],
    "closest_variant_key": "TATA-TIAGOEV-SMART19-192",
    "what_it_would_take": [
      "Accept 5 seats; you asked for 7.",
      "Confirm with the maker: AWD is not stated for this variant."
    ]
  }
}
